{
  "schemaVersion": "aidc.robot.physics/0.1",
  "modelId": "aidc.standard.single-joint",
  "modelRevision": "p0-r1",
  "coordinateSystem": {
    "lengthUnit": "m",
    "angleUnit": "rad",
    "forward": "+X",
    "left": "+Y",
    "up": "+Z",
    "geometryQuaternionOrder": "xyzw"
  },
  "rootBodyId": "base",
  "bodies": [
    {
      "bodyId": "base",
      "translation_m": [0, 0, 0],
      "rotation_xyzw": [0, 0, 0, 1],
      "mass_kg": 1,
      "centerOfMass_m": [0, 0, 0],
      "inertia_kg_m2": { "ixx": 0.01, "iyy": 0.01, "izz": 0.01, "ixy": 0, "ixz": 0, "iyz": 0 },
      "collisionAssetIds": []
    },
    {
      "bodyId": "link",
      "parentBodyId": "base",
      "translation_m": [0, 0, 0],
      "rotation_xyzw": [0, 0, 0, 1],
      "mass_kg": 0.25,
      "centerOfMass_m": [0.05, 0, 0],
      "inertia_kg_m2": { "ixx": 0.0001, "iyy": 0.01, "izz": 0.01, "ixy": 0, "ixz": 0, "iyz": 0 },
      "collisionAssetIds": []
    }
  ],
  "joints": [
    {
      "jointId": "joint-1",
      "type": "revolute",
      "parentBodyId": "base",
      "childBodyId": "link",
      "translation_m": [0, 0, 0],
      "rotation_xyzw": [0, 0, 0, 1],
      "axis": [0, 0, 1],
      "zeroOffset_rad": 0,
      "initialPosition_rad": 0,
      "limit": { "lower": -1.5707963267948966, "upper": 1.5707963267948966, "velocity": 10, "effort": 1 },
      "damping_Nm_s_rad": 0.2,
      "friction_Nm": 0,
      "armature_kg_m2": 0
    }
  ],
  "contactDefaults": {
    "friction": 0.8,
    "contactMargin_m": 0.0002,
    "excludedBodyPairs": [["base", "link"]]
  }
}
